{
  "schemaVersion": "0.1-spike",
  "generator": {
    "id": "grafting-graph-ir-spike",
    "version": 1
  },
  "inputHash": "2811dec785eb0a565cab7dba1a74c357c74880e8768545d49799cda2cc34a19b",
  "nodes": [
    {
      "id": "agent:claude",
      "kind": "agent",
      "label": "claude",
      "tags": [
        "provider:anthropic"
      ],
      "source": ".ai/registry/agents.yaml"
    },
    {
      "id": "agent:codex",
      "kind": "agent",
      "label": "codex",
      "tags": [
        "provider:openai"
      ],
      "source": ".ai/registry/agents.yaml"
    },
    {
      "id": "agent:gemini",
      "kind": "agent",
      "label": "gemini",
      "tags": [
        "provider:google"
      ],
      "source": ".ai/registry/agents.yaml"
    },
    {
      "id": "agent:repository-owner",
      "kind": "agent",
      "label": "repository-owner",
      "tags": [
        "provider:human"
      ],
      "source": ".ai/registry/agents.yaml"
    },
    {
      "id": "project:architecture-studio",
      "kind": "project",
      "label": "architecture-studio",
      "tags": [
        "lang:typescript",
        "npm:private",
        "platform:web",
        "scope:knowledge",
        "type:app"
      ],
      "source": "apps/architecture-studio/project.json"
    },
    {
      "id": "project:discretize",
      "kind": "project",
      "label": "discretize",
      "tags": [
        "lang:rust",
        "npm:private",
        "platform:web",
        "scope:procgen",
        "type:lib"
      ],
      "source": "libs/domains/procgen/discretize/project.json"
    },
    {
      "id": "project:engine-compute-api",
      "kind": "project",
      "label": "engine-compute-api",
      "tags": [
        "lang:rust",
        "platform:cross",
        "scope:engine",
        "type:lib"
      ],
      "source": "libs/engine/compute-api/project.json"
    },
    {
      "id": "project:engine-compute-cpu",
      "kind": "project",
      "label": "engine-compute-cpu",
      "tags": [
        "lang:rust",
        "platform:cross",
        "scope:engine",
        "type:lib"
      ],
      "source": "libs/engine/compute-cpu/project.json"
    },
    {
      "id": "project:engine-domain-core",
      "kind": "project",
      "label": "engine-domain-core",
      "tags": [
        "lang:rust",
        "platform:cross",
        "scope:engine",
        "type:lib"
      ],
      "source": "libs/engine/domain-core/project.json"
    },
    {
      "id": "project:generation-wasm",
      "kind": "project",
      "label": "generation-wasm",
      "tags": [
        "lang:rust",
        "npm:private",
        "platform:web",
        "scope:procgen",
        "type:lib"
      ],
      "source": "libs/domains/procgen/generation-wasm/project.json"
    },
    {
      "id": "project:grafting",
      "kind": "project",
      "label": "grafting",
      "tags": [
        "npm:private",
        "scope:root",
        "type:tooling"
      ],
      "source": "./project.json"
    },
    {
      "id": "project:graph-core",
      "kind": "project",
      "label": "graph-core",
      "tags": [
        "lang:rust",
        "platform:cross",
        "scope:shared",
        "type:lib"
      ],
      "source": "libs/graph/core/project.json"
    },
    {
      "id": "project:ia-graft",
      "kind": "project",
      "label": "ia-graft",
      "tags": [
        "lang:typescript",
        "npm:private",
        "platform:node",
        "scope:tooling",
        "type:cli"
      ],
      "source": "tools/ia-graft/project.json"
    },
    {
      "id": "project:isekai-capi-bridge",
      "kind": "project",
      "label": "isekai-capi-bridge",
      "tags": [
        "lang:rust",
        "platform:cross",
        "scope:engine",
        "type:binding"
      ],
      "source": "libs/isekai/capi-bridge/project.json"
    },
    {
      "id": "project:isekai-dotnet-interop",
      "kind": "project",
      "label": "isekai-dotnet-interop",
      "tags": [
        "lang:csharp",
        "platform:desktop",
        "scope:engine",
        "type:binding"
      ],
      "source": "dotnet/Grafting.Isekai.Interop/project.json"
    },
    {
      "id": "project:isekai-dotnet-protocol",
      "kind": "project",
      "label": "isekai-dotnet-protocol",
      "tags": [
        "lang:csharp",
        "platform:desktop",
        "scope:engine",
        "type:contracts"
      ],
      "source": "dotnet/Grafting.Isekai.Protocol/project.json"
    },
    {
      "id": "project:isekai-wasm-bridge",
      "kind": "project",
      "label": "isekai-wasm-bridge",
      "tags": [
        "lang:rust",
        "npm:private",
        "platform:web",
        "scope:engine",
        "type:binding"
      ],
      "source": "libs/isekai/wasm-bridge/project.json"
    },
    {
      "id": "project:isekai-web-client",
      "kind": "project",
      "label": "isekai-web-client",
      "tags": [
        "lang:typescript",
        "npm:private",
        "platform:web",
        "scope:engine",
        "type:lib"
      ],
      "source": "packages/isekai-web-client/project.json"
    },
    {
      "id": "project:render-3d",
      "kind": "project",
      "label": "render-3d",
      "tags": [
        "lang:typescript",
        "npm:private",
        "platform:web",
        "scope:shared",
        "type:render-engine"
      ],
      "source": "packages/render-3d/project.json"
    },
    {
      "id": "project:tileset-wfc",
      "kind": "project",
      "label": "tileset-wfc",
      "tags": [
        "lang:rust",
        "npm:private",
        "platform:web",
        "scope:procgen",
        "type:lib"
      ],
      "source": "libs/domains/procgen/tileset-wfc/project.json"
    },
    {
      "id": "project:ui",
      "kind": "project",
      "label": "ui",
      "tags": [
        "lang:typescript",
        "npm:private",
        "platform:web",
        "scope:shared",
        "type:ui"
      ],
      "source": "packages/ui/project.json"
    },
    {
      "id": "project:vtt",
      "kind": "project",
      "label": "vtt",
      "tags": [
        "lang:typescript",
        "npm:private",
        "platform:web",
        "scope:vtt",
        "type:app"
      ],
      "source": "apps/vtt/project.json"
    },
    {
      "id": "project:x6-canvas",
      "kind": "project",
      "label": "x6-canvas",
      "tags": [
        "lang:typescript",
        "lifecycle:retired",
        "npm:private",
        "platform:web",
        "scope:shared",
        "type:ui-adapter"
      ],
      "source": "packages/x6-canvas/project.json"
    }
  ],
  "edges": [
    {
      "id": "project:architecture-studio->project:discretize:depends_on:implicit",
      "kind": "depends_on",
      "source": "project:architecture-studio",
      "target": "project:discretize",
      "evidence": "docs/generated/project-graph.json#implicit"
    },
    {
      "id": "project:architecture-studio->project:discretize:depends_on:static",
      "kind": "depends_on",
      "source": "project:architecture-studio",
      "target": "project:discretize",
      "evidence": "docs/generated/project-graph.json#static"
    },
    {
      "id": "project:architecture-studio->project:generation-wasm:depends_on:implicit",
      "kind": "depends_on",
      "source": "project:architecture-studio",
      "target": "project:generation-wasm",
      "evidence": "docs/generated/project-graph.json#implicit"
    },
    {
      "id": "project:architecture-studio->project:generation-wasm:depends_on:static",
      "kind": "depends_on",
      "source": "project:architecture-studio",
      "target": "project:generation-wasm",
      "evidence": "docs/generated/project-graph.json#static"
    },
    {
      "id": "project:architecture-studio->project:isekai-wasm-bridge:depends_on:implicit",
      "kind": "depends_on",
      "source": "project:architecture-studio",
      "target": "project:isekai-wasm-bridge",
      "evidence": "docs/generated/project-graph.json#implicit"
    },
    {
      "id": "project:architecture-studio->project:isekai-wasm-bridge:depends_on:static",
      "kind": "depends_on",
      "source": "project:architecture-studio",
      "target": "project:isekai-wasm-bridge",
      "evidence": "docs/generated/project-graph.json#static"
    },
    {
      "id": "project:architecture-studio->project:render-3d:depends_on:static",
      "kind": "depends_on",
      "source": "project:architecture-studio",
      "target": "project:render-3d",
      "evidence": "docs/generated/project-graph.json#static"
    },
    {
      "id": "project:architecture-studio->project:tileset-wfc:depends_on:static",
      "kind": "depends_on",
      "source": "project:architecture-studio",
      "target": "project:tileset-wfc",
      "evidence": "docs/generated/project-graph.json#static"
    },
    {
      "id": "project:architecture-studio->project:ui:depends_on:implicit",
      "kind": "depends_on",
      "source": "project:architecture-studio",
      "target": "project:ui",
      "evidence": "docs/generated/project-graph.json#implicit"
    },
    {
      "id": "project:architecture-studio->project:ui:depends_on:static",
      "kind": "depends_on",
      "source": "project:architecture-studio",
      "target": "project:ui",
      "evidence": "docs/generated/project-graph.json#static"
    },
    {
      "id": "project:engine-compute-cpu->project:engine-compute-api:depends_on:implicit",
      "kind": "depends_on",
      "source": "project:engine-compute-cpu",
      "target": "project:engine-compute-api",
      "evidence": "docs/generated/project-graph.json#implicit"
    },
    {
      "id": "project:isekai-capi-bridge->project:engine-domain-core:depends_on:implicit",
      "kind": "depends_on",
      "source": "project:isekai-capi-bridge",
      "target": "project:engine-domain-core",
      "evidence": "docs/generated/project-graph.json#implicit"
    },
    {
      "id": "project:isekai-dotnet-interop->project:isekai-capi-bridge:depends_on:implicit",
      "kind": "depends_on",